[
  {
    "question": "Qual é a importância da lógica na programação?",
    "answer": "De acordo com o contexto, a importância da lógica na programação é:\n\n* Requisito para programar;\n* Grande diferencial entre os programadores;\n* Reconhecer, interpretar e estruturar o problema.",
    "contexts": [
      "Café \nEsquentar \nÁgua \nPó de Café \nno Filtro \nFiltro na \nJarra \nÁgua no \nFiltro \nÁgua na \nChaleira\nINTRODUÇÃO À LÓGICA \nAlgoritmos, Estruturas de Dados e\nLógica de Programação \n“Lógica de programação é a técnica de encadear \npensamentos para atingir determinado objetivo” \nPaulo Sérgio de Moraes – Unicamp \n \n• Importância? \n– Requisito para programar; \n– Grande diferencial entre os programadores; \n– Reconhecer, interpretar e estruturar o problema: \n• Solucionar o problema;\nLógica de Programação \n \n• Definições: \n– Instruções: (algoritmo) \n• Comandos ou ações; \n• Atividade parcial; \n– Sequência Lógica: (lógica) \n• Ordem das instruções; \n• Completar a atividade.\nLógica de Programação \n• Sequência Lógica Simples para “Passar Café”: \nEsquentar \nÁgua \nPó de Café \nno Filtro \nFiltro na \nJarra",
      "processadas? \n– Entrada! Teclado, Arquivos, Bancos de Dados, ... \n6. Como utilizar o resultado do processamento? \n– Saída! Tela, Arquivos, Comandos elétricos, ...\nFunção do Software \nSoftware: \nAlgoritmo \nComputador: \nProcessamento \nEntrada \nSaída\nRELAÇÕES ENTRE AS ÁREAS \nAlgoritmos, Lógica e Estruturas de Dados\nComposição do Software \n30% \n30% \n30% \n10% \nAlgoritmos \nLógica de Programação \nEstruturas de Dados \nLinguagem de \nProgramação\nRelações entre as Partes \nAlgoritmos \nEstruturas de \nDados \nLógica \nLinguagem\nINTRODUÇÃO À ALGORITMOS \nLógica de Programação, Estruturas de Dados e\nAlgoritmos \n• Forma de descrever uma tarefa, função ou \nprograma de computador; \n• Pode ser representado por pseudocódigo ou \nfluxograma; \n• Representa uma sequência de passos que o",
      "Lógica de Programação, \nAlgoritmos e Estruturas de Dados \nProfessor: \nVilson Heck Junior \nvilson.junior@ifsc.edu.br\nAgenda \n• Funções Básicas do Software; \n• Relações entre áreas; \n• Introdução à Algoritmos; \n• Introdução à Lógica; \n• Introdução à Estruturas de Dados; \n \n \nMaiores detalhes nas próximas aulas.\nFUNÇÕES BÁSICAS DO SOFTWARE \nEntrada, Saída e Processamento\nFunção do Software \n1. O que faz um software? \n– Processamento! \n2. O que um software precisa para processar? \n– Informações ou Dados! \n3. Qual é o resultado de um processamento? \n– Informações, Dados ou Conhecimento!\nFunção do Software \n4. Como definir o processamento? \n– Através do Algoritmo! \n5. De onde obter as informações à serem \nprocessadas? \n– Entrada! Teclado, Arquivos, Bancos de Dados, ...",
      "Esquentar \nÁgua \nPó de Café \nno Filtro \nFiltro na \nJarra \nÁgua no \nFiltro \nÁgua na \nChaleira \nCafé \n2 - Esquentar Água \n4 - Pó de Café no Filtro \n3 - Filtro na Jarra \n5 - Água no Filtro \n1 - Água na Chaleira\nLógica de Programação \n• Sequência Lógica Simples para “Passar Café”: \nEsquentar \nÁgua \nPó de Café \nno Filtro \nFiltro na \nJarra \nÁgua no \nFiltro \nÁgua na \nChaleira \nCafé\n• Sequência Lógica Simples para “Passar Café”: \nLógica de Programação \nEsquentar \nÁgua \nPó de Café \nno Filtro \nFiltro na \nJarra \nÁgua no \nFiltro \nÁgua na \nChaleira \nCafé\nESTRUTURAS DE DADOS \nAlgoritmos, Lógica e Introdução à\nEstruturas de Dados \nNossos algoritmos trabalham com Dados. \nVamos começar separando o tema: \n1. Dados; \n2. Estruturas; \n3. Armazenamento;\nDados na Informática \n• O que é, ou pode ser, um “dado”?"
    ],
    "ground_truth": "De acordo com o contexto, a importância da lógica na programação é:\n\n* Requisito para programar;\n* Grande diferencial entre os programadores;\n* Reconhecer, interpretar e estruturar o problema."
  },
  {
    "question": "Como definir o processamento de um software e quais são as funções básicas do software?",
    "answer": "Segundo o contexto, a função do software é processar informações ou dados. O processamento é definido por meio de algoritmo.\n\nAs funções básicas do software são:\n\n1. Entrada: fornece as informações ou dados que precisam ser processadas;\n2. Processamento: utiliza o algoritmo para realizar a manipulação dos dados;\n3. Saída: apresenta o resultado do processamento, que pode ser informação, dados ou conhecimento.\n\nEssas são as funções básicas do software, que permitem que ele realize suas tarefas e objetivos.",
    "contexts": [
      "Lógica de Programação, \nAlgoritmos e Estruturas de Dados \nProfessor: \nVilson Heck Junior \nvilson.junior@ifsc.edu.br\nAgenda \n• Funções Básicas do Software; \n• Relações entre áreas; \n• Introdução à Algoritmos; \n• Introdução à Lógica; \n• Introdução à Estruturas de Dados; \n \n \nMaiores detalhes nas próximas aulas.\nFUNÇÕES BÁSICAS DO SOFTWARE \nEntrada, Saída e Processamento\nFunção do Software \n1. O que faz um software? \n– Processamento! \n2. O que um software precisa para processar? \n– Informações ou Dados! \n3. Qual é o resultado de um processamento? \n– Informações, Dados ou Conhecimento!\nFunção do Software \n4. Como definir o processamento? \n– Através do Algoritmo! \n5. De onde obter as informações à serem \nprocessadas? \n– Entrada! Teclado, Arquivos, Bancos de Dados, ...",
      "processadas? \n– Entrada! Teclado, Arquivos, Bancos de Dados, ... \n6. Como utilizar o resultado do processamento? \n– Saída! Tela, Arquivos, Comandos elétricos, ...\nFunção do Software \nSoftware: \nAlgoritmo \nComputador: \nProcessamento \nEntrada \nSaída\nRELAÇÕES ENTRE AS ÁREAS \nAlgoritmos, Lógica e Estruturas de Dados\nComposição do Software \n30% \n30% \n30% \n10% \nAlgoritmos \nLógica de Programação \nEstruturas de Dados \nLinguagem de \nProgramação\nRelações entre as Partes \nAlgoritmos \nEstruturas de \nDados \nLógica \nLinguagem\nINTRODUÇÃO À ALGORITMOS \nLógica de Programação, Estruturas de Dados e\nAlgoritmos \n• Forma de descrever uma tarefa, função ou \nprograma de computador; \n• Pode ser representado por pseudocódigo ou \nfluxograma; \n• Representa uma sequência de passos que o",
      "• Número: OK. \n– Mas e uma matriz numérica? \n• Letra: OK. \n– Mas e um nome? \n• Pixel: OK. \n– Mas e uma imagem completa?\nEstruturas de Dados \n• Definição: \n– Uma estrutura de dados é um modo particular de \narmazenamento e organização de dados em um \ncomputador de modo que possam ser usados \neficientemente.\nEstruturas de Dados \n• Vetores, Matrizes, Imagens e diversas outras \ncomposições de tipos de dados podem ser \nchamados de estruturas de dados. \n• As Estruturas de Dados permitem melhor \norganização para o armazenamento e \nmanipulação de dados.\nConclusões \n• Algoritmos nos mostram os passos; \n• Lógica se preocupa com a coerência; \n• Estruturas de dados com o armazenamento e \nmanipulação dos dados; \n• A linguagem em colocar tudo em prática. \n \nVeremos cada um destes mais a fundo.",
      "2. Estruturas; \n3. Armazenamento;\nDados na Informática \n• O que é, ou pode ser, um “dado”? \n– É um número; \n– É um nome; \n– É um endereço; \n– É o valor de um produto; \n– É um pixel de uma imagem; \n– Pode ser muitas coisas...\nEstruturas \n• Para você, o que é uma “estrutura”? \n– É algo que dá forma? \n– É algo que sustenta? \n– Segundo Houaiss: “aquilo que dá sustentação \n(concreta ou abstrata) a alguma coisa; armação, \narcabouço”.\nComo Armazenar Dados? \n• Dados são representados em pequenas \nestruturas e em geral são chamados de \nvariáveis ou constantes! \n \n• Tudo que é armazenado dentro do \ncomputador, permanece em alguma \nmemória!\nA Memória do Computador\nComo Armazenar Dados? \n• Variáveis: armazenam dados em caráter \ntemporário e tem conteúdo dinâmico, ou seja,"
    ],
    "ground_truth": "Segundo o contexto, a função do software é processar informações ou dados. O processamento é definido por meio de algoritmo.\n\nAs funções básicas do software são:\n\n1. Entrada: fornece as informações ou dados que precisam ser processadas;\n2. Processamento: utiliza o algoritmo para realizar a manipulação dos dados;\n3. Saída: apresenta o resultado do processamento, que pode ser informação, dados ou conhecimento.\n\nEssas são as funções básicas do software, que permitem que ele realize suas tarefas e objetivos."
  },
  {
    "question": "O que são estruturas de dados e como elas podem ser utilizadas para armazenar e manipular dados?",
    "answer": "Com base no contexto fornecido, posso responder à pergunta da seguinte maneira:\n\nAs estruturas de dados são modos particulares de armazenamento e organização de dados em um computador, permitindo a eficiente utilização e manipulação dos mesmos. Isso inclui estruturas como vetores, matrizes, imagens e outras composições de tipos de dados.\n\nPara armazenar e manipular dados, as estruturas de dados podem ser utilizadas para organizar e relacionar dados em diferentes níveis. Por exemplo, uma matriz pode ser usada para representar um conjunto de dados que têm relação entre si, enquanto um vetor pode ser usado para representar um conjunto de dados que não têm relação direta.\n\nAlém disso, as estruturas de dados podem ser utilizadas para armazenar e recuperar dados em diferentes memórias do computador, como a memória principal ou a memória cache. Isso permite uma melhor eficiência na manipulação e recuperação dos dados.\n\nEm resumo, as estruturas de dados são ferramentas importantes para armazenar e manipular dados, permitindo uma organização eficiente e fácil acesso aos mesmos.",
    "contexts": [
      "• Número: OK. \n– Mas e uma matriz numérica? \n• Letra: OK. \n– Mas e um nome? \n• Pixel: OK. \n– Mas e uma imagem completa?\nEstruturas de Dados \n• Definição: \n– Uma estrutura de dados é um modo particular de \narmazenamento e organização de dados em um \ncomputador de modo que possam ser usados \neficientemente.\nEstruturas de Dados \n• Vetores, Matrizes, Imagens e diversas outras \ncomposições de tipos de dados podem ser \nchamados de estruturas de dados. \n• As Estruturas de Dados permitem melhor \norganização para o armazenamento e \nmanipulação de dados.\nConclusões \n• Algoritmos nos mostram os passos; \n• Lógica se preocupa com a coerência; \n• Estruturas de dados com o armazenamento e \nmanipulação dos dados; \n• A linguagem em colocar tudo em prática. \n \nVeremos cada um destes mais a fundo.",
      "2. Estruturas; \n3. Armazenamento;\nDados na Informática \n• O que é, ou pode ser, um “dado”? \n– É um número; \n– É um nome; \n– É um endereço; \n– É o valor de um produto; \n– É um pixel de uma imagem; \n– Pode ser muitas coisas...\nEstruturas \n• Para você, o que é uma “estrutura”? \n– É algo que dá forma? \n– É algo que sustenta? \n– Segundo Houaiss: “aquilo que dá sustentação \n(concreta ou abstrata) a alguma coisa; armação, \narcabouço”.\nComo Armazenar Dados? \n• Dados são representados em pequenas \nestruturas e em geral são chamados de \nvariáveis ou constantes! \n \n• Tudo que é armazenado dentro do \ncomputador, permanece em alguma \nmemória!\nA Memória do Computador\nComo Armazenar Dados? \n• Variáveis: armazenam dados em caráter \ntemporário e tem conteúdo dinâmico, ou seja,",
      "• Variáveis: armazenam dados em caráter \ntemporário e tem conteúdo dinâmico, ou seja, \npodem ser acessadas ou alteradas a qualquer \nmomento; \n• Constantes: são dados estáticos, o seu \nconteúdo pode ser acessado a qualquer \nmomento, mas será definido no momento de \nsua criação e não poderá ser mais alterado.\nComo Armazenar Dados? \n• Todas as variáveis ou constantes são \nestruturadas por um tipo de dado! \n– Idade: \n• número inteiro; \n– Peso: \n• número fracionário; \n– Letra: \n• é um caractere; \n– Um pixel: \n• Um número inteiro que representa a luminosidade.\nComo Armazenar Dados? \nTipos de Dados Básicos: \n \n• Inteiro: números inteiros; \n• Real: números fracionários; \n• Caractere: letras; \n• Logico: verdadeiro ou falso;\nComo Armazenar Dados? \n• Partes básicas de uma variável ou constante:",
      "Como Armazenar Dados? \n• Partes básicas de uma variável ou constante: \nConteúdo: \n41 \nTipo de \nDado: \nInteiro \nNome: \nIdade\nComo Armazenar Dados? \n• Declarando uma variável, precisamos \ndeterminar: \n• Tipo de Dado: Referente aos valores que serão \narmazenados; \n• Nome: Identificação da variável, algo que indique o que \nela armazena; \n• Valor: Pré-determinado ou pós-determinado? \n– Sintaxe: \nNome: TipodeDado\nComo Armazenar Dados? \n• Atribuindo ou alterando valores dos dados: \n– Podemos apenas definir valores coerentes com o \ntipo de dado. \n– Sintaxe Correta: \nNome <- Valor \n– Erros comuns: \nIdade: inteiro \nIdade <- 22.0\nComo Armazenar Dados? \n• Regras para Nomear Variáveis: \n1. nomes de variáveis não podem ser iguais a palavras \nreservadas;"
    ],
    "ground_truth": "Com base no contexto fornecido, posso responder à pergunta da seguinte maneira:\n\nAs estruturas de dados são modos particulares de armazenamento e organização de dados em um computador, permitindo a eficiente utilização e manipulação dos mesmos. Isso inclui estruturas como vetores, matrizes, imagens e outras composições de tipos de dados.\n\nPara armazenar e manipular dados, as estruturas de dados podem ser utilizadas para organizar e relacionar dados em diferentes níveis. Por exemplo, uma matriz pode ser usada para representar um conjunto de dados que têm relação entre si, enquanto um vetor pode ser usado para representar um conjunto de dados que não têm relação direta.\n\nAlém disso, as estruturas de dados podem ser utilizadas para armazenar e recuperar dados em diferentes memórias do computador, como a memória principal ou a memória cache. Isso permite uma melhor eficiência na manipulação e recuperação dos dados.\n\nEm resumo, as estruturas de dados são ferramentas importantes para armazenar e manipular dados, permitindo uma organização eficiente e fácil acesso aos mesmos."
  }
]